{
  "formatVersion": 1,
  "id": "planner",
  "role": "planner",
  "orchestrator": "langgraph",
  "availability": "unavailable",
  "bootstrapProfileId": "economy",
  "allowedProfileIds": [
    "economy",
    "deliberate"
  ],
  "retrievalRequired": true,
  "outputContract": "execution-plan-v1",
  "canChangePolicy": false,
  "toolBindings": [
    {
      "id": "repository-context",
      "protocol": "mcp",
      "availability": "unavailable",
      "operations": [
        "read"
      ],
      "repositoryId": "fixture-repository",
      "runtimeId": "website-preview"
    },
    {
      "id": "plan-proposal",
      "protocol": "mcp",
      "availability": "unavailable",
      "operations": [
        "propose"
      ],
      "repositoryId": "fixture-repository",
      "runtimeId": "website-preview"
    }
  ]
}
